Last login: Thu Sep 22 23:49:40 on ttys000
(base) abhishektyagi@Abhisheks-MacBook-Air ~ % mysql -u root -p
Enter password: 
Welcome to the MySQL monitor.  Commands end with ; or \g.
Your MySQL connection id is 13
Server version: 8.0.30 MySQL Community Server - GPL

Copyright (c) 2000, 2022, Oracle and/or its affiliates.

Oracle is a registered trademark of Oracle Corporation and/or its
affiliates. Other names may be trademarks of their respective
owners.

Type 'help;' or '\h' for help. Type '\c' to clear the current input statement.

mysql> show databases;
+--------------------+
| Database           |
+--------------------+
| hello              |
| information_schema |
| mysql              |
| performance_schema |
| sys                |
+--------------------+
5 rows in set (0.00 sec)

mysql> connect hello;
Reading table information for completion of table and column names
You can turn off this feature to get a quicker startup with -A

Connection id:    14
Current database: hello

mysql> create table product(Id int,name varchar2(5),price int,Quantity int);
ERROR 1064 (42000): You have an error in your SQL syntax; check the manual that corresponds to your MySQL server version for the right syntax to use near 'varchar2(5),price int,Quantity int)' at line 1
mysql> create table Product(Id int,Name varchar(6),Price int,Quantity int);
Query OK, 0 rows affected (0.01 sec)

mysql> desc product;
+----------+------------+------+-----+---------+-------+
| Field    | Type       | Null | Key | Default | Extra |
+----------+------------+------+-----+---------+-------+
| Id       | int        | YES  |     | NULL    |       |
| Name     | varchar(6) | YES  |     | NULL    |       |
| Price    | int        | YES  |     | NULL    |       |
| Quantity | int        | YES  |     | NULL    |       |
+----------+------------+------+-----+---------+-------+
4 rows in set (0.00 sec)

mysql> insert into Product(id,name,price,Quantity)Values('1','Mouse','500','1');
Query OK, 1 row affected (0.00 sec)

mysql> select * from product;
+------+-------+-------+----------+
| Id   | Name  | Price | Quantity |
+------+-------+-------+----------+
|    1 | Mouse |   500 |        1 |
+------+-------+-------+----------+
1 row in set (0.00 sec)

mysql> Alter table product add Address varchar(7);
Query OK, 0 rows affected (0.01 sec)
Records: 0  Duplicates: 0  Warnings: 0

mysql> desc Product;
+----------+------------+------+-----+---------+-------+
| Field    | Type       | Null | Key | Default | Extra |
+----------+------------+------+-----+---------+-------+
| Id       | int        | YES  |     | NULL    |       |
| Name     | varchar(6) | YES  |     | NULL    |       |
| Price    | int        | YES  |     | NULL    |       |
| Quantity | int        | YES  |     | NULL    |       |
| Address  | varchar(7) | YES  |     | NULL    |       |
+----------+------------+------+-----+---------+-------+
5 rows in set (0.01 sec)

mysql> insert into product(id,name,Address)Values('1','KeyBoard','Panchvati');
ERROR 1406 (22001): Data too long for column 'Name' at row 1
mysql> insert into product(id,name,Address)Values('2','pen','chhapar');
Query OK, 1 row affected (0.00 sec)

mysql> select * from product;
+------+-------+-------+----------+---------+
| Id   | Name  | Price | Quantity | Address |
+------+-------+-------+----------+---------+
|    1 | Mouse |   500 |        1 | NULL    |
|    2 | pen   |  NULL |     NULL | chhapar |
+------+-------+-------+----------+---------+
2 rows in set (0.00 sec)

mysql> Alter table product add primary key(id);
Query OK, 0 rows affected (0.01 sec)
Records: 0  Duplicates: 0  Warnings: 0

mysql> desc product;
+----------+------------+------+-----+---------+-------+
| Field    | Type       | Null | Key | Default | Extra |
+----------+------------+------+-----+---------+-------+
| Id       | int        | NO   | PRI | NULL    |       |
| Name     | varchar(6) | YES  |     | NULL    |       |
| Price    | int        | YES  |     | NULL    |       |
| Quantity | int        | YES  |     | NULL    |       |
| Address  | varchar(7) | YES  |     | NULL    |       |
+----------+------------+------+-----+---------+-------+
5 rows in set (0.00 sec)

mysql> insert into product(name,price,Quantity,Address)Values('Pencil','200','4','silver');
ERROR 1364 (HY000): Field 'Id' doesn't have a default value
mysql> drop table product;
Query OK, 0 rows affected (0.01 sec)

mysql> create table Employee(id int ,name char(10),Address char(20) default 'Ghaziabad');
Query OK, 0 rows affected (0.01 sec)

mysql> desc Employee;
+---------+----------+------+-----+-----------+-------+
| Field   | Type     | Null | Key | Default   | Extra |
+---------+----------+------+-----+-----------+-------+
| id      | int      | YES  |     | NULL      |       |
| name    | char(10) | YES  |     | NULL      |       |
| Address | char(20) | YES  |     | Ghaziabad |       |
+---------+----------+------+-----+-----------+-------+
3 rows in set (0.00 sec)

mysql> insert into Employee(id,name)Values('1','Akhil');
Query OK, 1 row affected (0.00 sec)

mysql> select * from employee;
+------+-------+-----------+
| id   | name  | Address   |
+------+-------+-----------+
|    1 | Akhil | Ghaziabad |
+------+-------+-----------+
1 row in set (0.00 sec)

mysql> Alter table Employee add primary key(id);
Query OK, 0 rows affected (0.02 sec)
Records: 0  Duplicates: 0  Warnings: 0

mysql> desc employee;
+---------+----------+------+-----+-----------+-------+
| Field   | Type     | Null | Key | Default   | Extra |
+---------+----------+------+-----+-----------+-------+
| id      | int      | NO   | PRI | NULL      |       |
| name    | char(10) | YES  |     | NULL      |       |
| Address | char(20) | YES  |     | Ghaziabad |       |
+---------+----------+------+-----+-----------+-------+
3 rows in set (0.01 sec)

mysql> Alter table employee rename to Student;
ERROR 1050 (42S01): Table 'Student' already exists
mysql> Alter table Employee rename to product;
Query OK, 0 rows affected (0.01 sec)

mysql> desc product;
+---------+----------+------+-----+-----------+-------+
| Field   | Type     | Null | Key | Default   | Extra |
+---------+----------+------+-----+-----------+-------+
| id      | int      | NO   | PRI | NULL      |       |
| name    | char(10) | YES  |     | NULL      |       |
| Address | char(20) | YES  |     | Ghaziabad |       |
+---------+----------+------+-----+-----------+-------+
3 rows in set (0.00 sec)

mysql> desc Employee;
ERROR 1146 (42S02): Table 'hello.employee' doesn't exist
mysql> Alter table product add Blood_Group char(1);
Query OK, 0 rows affected (0.00 sec)
Records: 0  Duplicates: 0  Warnings: 0

mysql> desc product;
+-------------+----------+------+-----+-----------+-------+
| Field       | Type     | Null | Key | Default   | Extra |
+-------------+----------+------+-----+-----------+-------+
| id          | int      | NO   | PRI | NULL      |       |
| name        | char(10) | YES  |     | NULL      |       |
| Address     | char(20) | YES  |     | Ghaziabad |       |
| Blood_Group | char(1)  | YES  |     | NULL      |       |
+-------------+----------+------+-----+-----------+-------+
4 rows in set (0.00 sec)

mysql> insert into product values('2','Ajay','A+');
ERROR 1136 (21S01): Column count doesn't match value count at row 1
mysql> Alter table Product modify blood_Group char(3);
Query OK, 1 row affected (0.02 sec)
Records: 1  Duplicates: 0  Warnings: 0

mysql> desc product;
+-------------+----------+------+-----+-----------+-------+
| Field       | Type     | Null | Key | Default   | Extra |
+-------------+----------+------+-----+-----------+-------+
| id          | int      | NO   | PRI | NULL      |       |
| name        | char(10) | YES  |     | NULL      |       |
| Address     | char(20) | YES  |     | Ghaziabad |       |
| blood_Group | char(3)  | YES  |     | NULL      |       |
+-------------+----------+------+-----+-----------+-------+
4 rows in set (0.01 sec)

mysql> insert into product(id,name,blood_Group)values('3','Abhishek','A+');
Query OK, 1 row affected (0.01 sec)

mysql> select * from product;
+----+----------+-----------+-------------+
| id | name     | Address   | blood_Group |
+----+----------+-----------+-------------+
|  1 | Akhil    | Ghaziabad | NULL        |
|  3 | Abhishek | Ghaziabad | A+          |
+----+----------+-----------+-------------+
2 rows in set (0.00 sec)

mysql> insert into product(id,name,blood_Group)Values('4','Ajay','A-');
Query OK, 1 row affected (0.00 sec)

mysql> select * from product;
+----+----------+-----------+-------------+
| id | name     | Address   | blood_Group |
+----+----------+-----------+-------------+
|  1 | Akhil    | Ghaziabad | NULL        |
|  3 | Abhishek | Ghaziabad | A+          |
|  4 | Ajay     | Ghaziabad | A-          |
+----+----------+-----------+-------------+
3 rows in set (0.00 sec)

mysql> Updata product set blood_Group='o+' where id=1;
ERROR 1064 (42000): You have an error in your SQL syntax; check the manual that corresponds to your MySQL server version for the right syntax to use near 'Updata product set blood_Group='o+' where id=1' at line 1
mysql> Updata product set blood_Group='o+'; where id=1;
ERROR 1064 (42000): You have an error in your SQL syntax; check the manual that corresponds to your MySQL server version for the right syntax to use near 'Updata product set blood_Group='o+'' at line 1
ERROR 1064 (42000): You have an error in your SQL syntax; check the manual that corresponds to your MySQL server version for the right syntax to use near 'where id=1' at line 1
mysql> Updata product set blood_Group='o+' where id=1;
ERROR 1064 (42000): You have an error in your SQL syntax; check the manual that corresponds to your MySQL server version for the right syntax to use near 'Updata product set blood_Group='o+' where id=1' at line 1
mysql> Update product set blood_Group='o+' where id=1;
Query OK, 1 row affected (0.00 sec)
Rows matched: 1  Changed: 1  Warnings: 0

mysql> select * from product;
+----+----------+-----------+-------------+
| id | name     | Address   | blood_Group |
+----+----------+-----------+-------------+
|  1 | Akhil    | Ghaziabad | o+          |
|  3 | Abhishek | Ghaziabad | A+          |
|  4 | Ajay     | Ghaziabad | A-          |
+----+----------+-----------+-------------+
3 rows in set (0.01 sec)

mysql> Alter table product(name) rename to Name_Employee;
ERROR 1064 (42000): You have an error in your SQL syntax; check the manual that corresponds to your MySQL server version for the right syntax to use near '(name) rename to Name_Employee' at line 1
mysql> update product set Address='Delhi',name='Ajay';
Query OK, 3 rows affected (0.00 sec)
Rows matched: 3  Changed: 3  Warnings: 0

mysql> select * from product;
+----+------+---------+-------------+
| id | name | Address | blood_Group |
+----+------+---------+-------------+
|  1 | Ajay | Delhi   | o+          |
|  3 | Ajay | Delhi   | A+          |
|  4 | Ajay | Delhi   | A-          |
+----+------+---------+-------------+
3 rows in set (0.00 sec)

mysql> update product set name='Abhishek' where id = 3;
Query OK, 1 row affected (0.00 sec)
Rows matched: 1  Changed: 1  Warnings: 0

mysql> select * from product;
+----+----------+---------+-------------+
| id | name     | Address | blood_Group |
+----+----------+---------+-------------+
|  1 | Ajay     | Delhi   | o+          |
|  3 | Abhishek | Delhi   | A+          |
|  4 | Ajay     | Delhi   | A-          |
+----+----------+---------+-------------+
3 rows in set (0.00 sec)

mysql> update product set name='Akhil',Address='Utrakhand' where id =4;
Query OK, 1 row affected (0.01 sec)
Rows matched: 1  Changed: 1  Warnings: 0

mysql> select * from product;
+----+----------+-----------+-------------+
| id | name     | Address   | blood_Group |
+----+----------+-----------+-------------+
|  1 | Ajay     | Delhi     | o+          |
|  3 | Abhishek | Delhi     | A+          |
|  4 | Akhil    | Utrakhand | A-          |
+----+----------+-----------+-------------+
3 rows in set (0.00 sec)

mysql> update product set Address='Pune' where id=1;
Query OK, 1 row affected (0.00 sec)
Rows matched: 1  Changed: 1  Warnings: 0

mysql> select * from product;
+----+----------+-----------+-------------+
| id | name     | Address   | blood_Group |
+----+----------+-----------+-------------+
|  1 | Ajay     | Pune      | o+          |
|  3 | Abhishek | Delhi     | A+          |
|  4 | Akhil    | Utrakhand | A-          |
+----+----------+-----------+-------------+
3 rows in set (0.00 sec)

mysql> delete from product where id =1;
Query OK, 1 row affected (0.01 sec)

mysql> select * from product;
+----+----------+-----------+-------------+
| id | name     | Address   | blood_Group |
+----+----------+-----------+-------------+
|  3 | Abhishek | Delhi     | A+          |
|  4 | Akhil    | Utrakhand | A-          |
+----+----------+-----------+-------------+
2 rows in set (0.00 sec)

mysql> delete from product name where id =3;
Query OK, 1 row affected (0.01 sec)

mysql> select * from product;
+----+-------+-----------+-------------+
| id | name  | Address   | blood_Group |
+----+-------+-----------+-------------+
|  4 | Akhil | Utrakhand | A-          |
+----+-------+-----------+-------------+
1 row in set (0.01 sec)

mysql> delete name from product  where id =3;
ERROR 1109 (42S02): Unknown table 'name' in MULTI DELETE
mysql> delete 9name from product  where id =3;
ERROR 1109 (42S02): Unknown table '9name' in MULTI DELETE
mysql> delete (name) from product  where id =3;
ERROR 1064 (42000): You have an error in your SQL syntax; check the manual that corresponds to your MySQL server version for the right syntax to use near '(name) from product  where id =3' at line 1
mysql> Alter table product drop column name;
Query OK, 0 rows affected (0.01 sec)
Records: 0  Duplicates: 0  Warnings: 0

mysql> select * from product;
+----+-----------+-------------+
| id | Address   | blood_Group |
+----+-----------+-------------+
|  4 | Utrakhand | A-          |
+----+-----------+-------------+
1 row in set (0.00 sec)

mysql> desc product;
+-------------+----------+------+-----+-----------+-------+
| Field       | Type     | Null | Key | Default   | Extra |
+-------------+----------+------+-----+-----------+-------+
| id          | int      | NO   | PRI | NULL      |       |
| Address     | char(20) | YES  |     | Ghaziabad |       |
| blood_Group | char(3)  | YES  |     | NULL      |       |
+-------------+----------+------+-----+-----------+-------+
3 rows in set (0.01 sec)

mysql> 
